Name,Keywords,Result
Leadership Development for Engineers,"leadership development, engineers","What Makes Leadership Development Programs Succeed?, 7 Steps to Create a Leadership Development Plan, Leadership Development, The Future of Leadership Development, 10 Key Leadership Development Areas (With Examples), Leadership Development Programs: A Complete Guide, Developing Organizational Leaders, Leadership Development Program, Leadership Development Studies, Engineer, What Is an Engineer? (Types, Salaries and Responsibilities), ASCE: Home, Headquarters U.S. Army Corps of Engineers, What does an engineer do?, 6 Types of Engineers: What They Do, Outlook, and Salary, ENGINEER | definition in the Cambridge English Dictionary, Architecture and Engineering Occupations, Engineer Definition & Meaning"
Quantum Mechanics for Engineers,"quantum mechanics, engineers","Quantum mechanics, Quantum mechanics | Definition, Development, & Equations, Quantum Mechanics - Stanford Encyclopedia of Philosophy, Introduction to quantum mechanics, What is quantum mechanics?, Introduction to quantum mechanics, Quantum mechanics: Definitions, axioms, and key ..., Quantum Mechanics, Engineer, What Is an Engineer? (Types, Salaries and Responsibilities), ASCE: Home, Headquarters U.S. Army Corps of Engineers, What does an engineer do?, 6 Types of Engineers: What They Do, Outlook, and Salary, ENGINEER | definition in the Cambridge English Dictionary, Architecture and Engineering Occupations, Engineer Definition & Meaning"
Analyzing Time Series and Sequential Data,"analyzing time series, sequential data","Time Series Analysis: Definition, Types & Techniques, The Ultimate Guide to Time-Series Analysis, Time Series Analysis and Forecasting | Data-Driven Insights, Time Series Analysis: Definition, Types & Examples, 6.4. Introduction to Time Series Analysis, What Is a Time Series and How Is It Used to Analyze Data?, What is Time Series Analysis?, The Complete Guide to Time Series Analysis and ..., Time series, Time Series Data Analysis: Definitions & Best Techniques ..., Sequential Data ï¿½ï¿½ï¿½ and the Neural Network Conundrum!, An Introduction to Deep Learning for Sequential Data, What do you mean by Sequence data? Discuss ..., machine learning - Sequence data vs time series data, Lecture 10: Sequential Data Models, Machine Learning for Sequential Data: A Review, A Tutorial on Sequential Machine Learning, Machine Learning for Sequential Data: A "
"Coding for Designers, Managers, and Entrepreneurs","managers, entrepreneurs, designers, coding","Managers and Leaders: Are They Different?, What Is a Manager?, 4 Different Types of Managers, Management Occupations, What Does It Mean to Be a Manager Today?, How To Be A Manager, Meaning of manager in English - Cambridge Dictionary, Types of Managers and Their Roles, Manager Definition & Meaning, The 10 Greatest Entrepreneurs, Entrepreneurs, 30 of the Most Famous Entrepreneurs, Entrepreneurs' Organization Home, 30 Most Influential Entrepreneurs Of All Time - Income Diary, Entrepreneurs and the Truth, The 25 Most Important Entrepreneurs of the Past 25 Years, Entrepreneurship, 11 Most Famous Entrepreneurs of All Time (and What ..., All Fashion Show Designers, Designer Boutiques, Designer Brands List at Neiman Marcus, Designer Brands, All designers, All designers, List of fashion designers, DESIGNERS GUILDï¿½ï¿½ï¿½ Official Site, Fashion and Accessories Designers, Popular Designer Brands, Code.org: Learn today, build a brighter tomorrow., Codecademy: Learn to Code - for Free, What Is Coding and What Is It Used Learn - Hour of Code, How to Start Coding: The Ultimate Guide for Beginner ..., What Is Coding and What Is It Used For?, Coding Games and Programming Challenges to Code Better"
PepsiCo: Water Stewardship,"water stewardship, pepsico","About the Alliance for Water Stewardship, The Basics ï¿½ï¿½ï¿½ What is Water Stewardship?, Water Stewardship, Corporate Water Stewardship | Initiatives | WWF, Alliance for Water Stewardship: Home, How we're supporting our commitment to water stewardship, Water Stewardship - Amazon Sustainability, Water Stewardship 101, Water Stewardship Will Be One Of The Biggest Food ..., PepsiCo, PepsiCo Careers, PepsiCo, PepsiCo, Inc. (PEP) Stock Price, News, Quote & History, PepsiCo Partners | PepsiCo Partners, Pepsi.com, PepsiCo | PEP Stock Price, Company Overview "
Nutrition Education for the Consumer,"nutrition education, consumer","Nutrition Education & Food Safety, Healthy Eating Learning Opportunities and Nutrition ..., Nutrition Education, Nutrition Education Resources & Materials, Nutrition.gov, Nutrition Education - Texas Health and Human Services, Nutrition Education - an overview, Nutrition education, Nutrition Education, Consumer Reports: Product Reviews and Ratings, Consumer Financial Protection Bureau, Consumer, Consumers Energy: Home, Consumer Cellular Cell Phones & Plans | Consumer Cellular, consumer.gov | what to know and do, Consumer Brands Association, Consumer Definition & Meaning, Federal Trade Commission: Consumer Advice, What We Do"
Statistical Learning for Data Science,"statistical learning, data science","An Introduction to Statistical Learning, Statistical learning theory, Statistical Learning | Stanford Online, 1 An Introduction to Statistical Learning, StanfordOnline: Statistical Learning with R, An Introduction to Statistical Learning: with Applications in ..., Statistical learning in language acquisition, The Elements of Statistical Learning - Trevor Hastie, StanfordOnline: Statistical Learning with Python, Statistical Learning with Python | Stanford Online, Data science, What is Data Science?, What is Data Science? - UC Berkeley Online, What is Data Science?, What Is Data Science? Definition, Examples, Jobs, and More, Best Data Science Courses Online [2024], What is Data Science? A Simple Explanation and More, What Is Data Science?"
ESG Investing: Financial Decisions in Flux,"financial decisions, esg investing, flux","FinDec ï¿½ï¿½ï¿½ Lets Talk About Your future, Financial knowledge and decision-making skills, Financial Decisions, The Key To Good Financial Decisionsï¿½ï¿½ï¿½Connecting With ..., Financial Decisions - Little Rock, AR, Step 3: Making Smart Financial Decisions, Top 10 Most Common Financial Mistakes, How to Make Financial Decisions That Reflect Your Values, Forbes Advisor ï¿½ï¿½ï¿½ Smart Financial Decisions Made Simple, What Is ESG Investing? ï¿½ï¿½ï¿½ Forbes Advisor, What is ESG Investing?, Environmental social and governance (ESG) investing, What is ESG Investing?, ESG for Beginners: Environmental, Social and Governance ..., ESG 101: What is Environmental, Social and Governance?, ESG funds that reflect what matters most to you, f.lux: software to make your life better, Flux, Flux Definition & Meaning, Flux | Decentralized Cloud Computing, Flux Brewing Co.,"
Essential English for University Success,"university success, essential english","University Success - Adult English Language Learning, University Success Reading Advanced, Student Book with ..., University Success Advanced, University Success Intermediate, University Success NEW, Success - University of Northern Iowa, Success | Leahy Community Health and Family Center, University Success, Understanding University Success. A Report from Standards ..., Essential English, 4000 Essential English Words 1, Paul Nation, Essential English, 4000 Essential English Words 1 - Apps on Google Play, 4000 Essential English Words, Book 1, 2nd Edition ..., 4000 Essential English Words, Book 1 2nd edition, 4000 Essential English Words (all books) [en-en]"
"Globalization, Economic Growth and Stability","economic growth, stability, globalization","Economic Growth - United Nations Sustainable Development, Economic growth, U.S. Economy at a Glance, Gross Domestic Product: An Economy's All, Economic Growth, Economic Growth | Explainer | Education, Economic Growth, Stability Definition & Meaning, STABILITY Definition & Meaning, STABILITY | definition in the Cambridge English Dictionary, Stability AI, STABILITY Synonyms: 54 Similar and Opposite Words, Stability, Stability - Definition, Meaning & Synonyms, Stability Definition & Meaning | Britannica Dictionary, NOAA's National Weather Service - Glossary, 39 Synonyms & Antonyms for STABILITY, Globalization, Globalization in Business With History and Pros and Cons, What is Globalization? Examples, Definition, Benefits and Effects, What is Globalization: Pros, Cons, and History, Globalization | Examples, Impact, & Pros and Cons, Effects of Economic Globalization, What Is Globalization?, Globalization: A Brief Overview, Defining Globalization - Globalization: A Resource Guide"
Exam Prep AZ-104: Microsoft Azure Administrator Associate,"microsoft azure administrator associate, exam prep az, 104","Microsoft Certified: Azure Administrator Associate, Course AZ-104T00-A: Microsoft Azure Administrator, Microsoft Certified: Azure Database Administrator Associate, AZ-104 Microsoft Azure Administrator Certification, Exam Prep AZ-104: Microsoft Azure Administrator ..., Study guide for Exam AZ-104: Microsoft Azure Administrator, AZ-104 Exam Preparation: Microsoft Azure Administrator, Microsoft Certified: Azure Administrator Associate, Microsoft Certified: Azure Solutions Architect Expert, Arizona Real Estate Exam Prep Solution - Salesperson, Arizona Exam Prep - MLO Classes, Arizona Real Estate Sales Exam Prep, Test Prep Courses - Think Tank - University of Arizona, Math Exam Prep - Think Tank - University of Arizona, Arizona Real Estate Exam Prep Online | ASREB, Arizona Salesperson Real Estate Exam Prep, Arizona Real Estate Exam Prep: In-Person Tutoring, Arizona B/B-2/KB-2 License Essential Exam Prep Package, 104ï¿½ï¿½ï¿½ï¿½ï¿½ï¿½ï¿½ï¿½ï¿½ï¿½ï¿½ï¿½ï¿½ï¿½ï¿½ï¿½ï¿½ï¿½ï¿½ï¿½ï¿½ï¿½ï¿½ï¿½ï¿½ï¿½ï¿½ï¿½ï¿½ï¿½ï¿½ï¿½ï¿½ Route 104, Wild 104, IBEW Local Union 104"
A Story of Economics: A Principles Tale,"principles tale, story, economics","A Story of Economics: A Principles Tale Specialization, Principle: A Tale (1849): James Nisbet and Company, Principle: A Tale (1849): James Nisbet and Company, james.denicco, 10 Essential Principles of Story with Daniel Joshua Rubin, The 10 Principles of Storytelling | by The Do Book Company, Principals' Principles: True Tales from the Golden Age of ..., 5 Children's Stories: Teaching Virtuous Principles, The 3 Key Principles That Guide Every Great Story, Storyline Online - Home, Story Definition & Meaning, story., Story ï¿½ï¿½ï¿½ Publisher of literary fiction and nonfiction, StoryCorps - Stories from people of all backgrounds and beliefs, Story, STORY Definition & Meaning, Short Stories for Children, What is Economics? - UB College of Arts and Sciences, What is economics?, What is Economics?, What Is Economics?, The Economist | Independent journalism, Economics Defined with Types, Indicators, and Systems, Economics | Definition, History, Examples, Types, & Facts, U.S. Bureau of Economic Analysis (BEA), What nomics?: Department of ..."
Finance for Everyone,"finance, everyone","Stock Market Prices, Real-time Quotes & Business News, Yahoo Finance - Stock Market Live, Quotes, Business ..., Financial Times, What Does Finance Mean? Its History, Types, and ..., Finance News, Finance | Definition, Types, & Facts | Britannica Money, CNBC: Stock Markets, Business News, Financials, Earnings, Finance, Finance Definition, Finance Definition & Meaning, Everyone Definition & Meaning, Everyone for every body, EVERYONE Definition & Meaning, Body Care Products - Everyone, EVERYONE | definition in the Cambridge English Dictionary, Mitski - Everyone (Official Audio), EVERYONE Synonyms: 11 Similar and Opposite Words, Amazon.com: Everyone, EveryONE - News and research from PLOS ONE, Everyone vs. Every Oneï¿½ï¿½ï¿½What's the Diff"
Digital Business,digital business,"What Is Digital Business? Overview, Concepts, and How ..., What is digital business?, CIBC digital business, What is digital transformation?, Definition of Digital Business - IT Glossary, What is Digital Business? Definition, Benefits, and Examples, What is Digital Business? A Beginner's Guide, Digital Business Management - Humber College, How to Start a Digital Business in 2024 | Mighty Pro"
Social Policy for Social Services & Health Practitioners,"social services, social policy, health practitioners","Social Services, Social services, State social service agencies, Virginia Department of Social Services: Home, Social service | Definition, Examples, Agencies, & Facts, Missouri Department of Social Services, Home | California Dept. of Social Services, Social Services | NCDHHS, Connecticut Department of Social Services - ConneCT, Social Services, Social policy, Center for the Study of Social Policy, Organizing for Social and Economic Justice: Social Policy, Policy Issues, Social Policy: Crash Course Government and Politics #49, Social Policy | The Harvard Kenneth C. Griffin Graduate ..., What is social policy?, Courses analyze how social policies and social institutions ..., Social policy, Who is considered a Health Care Provider/Practitioner?, Healthcare Practitioners and Technical Occupations, Health professional, NPDB Guidebook, Chapter C: Subjects of Reports, Definitions, Definition and list of health professionals, Types of health care providers, How To Become a Healthcare Practitioner in 10 Steps, Health Practitioner - an overview, International Association of Healthcare Practitioners, Providers ï¿½ï¿½ï¿½ El Paso "
Managing Major Engineering Projects,managing major engineering projects,"Managing Major Engineering Projects Specialization, How Engineering Managers Can Lead Major Projects, Online Course: Managing Major Engineering Projects ..., Managing Major Engineering Projects: new online course with ..., Managing engineering projects, Major Engineering Projects: Governance, Risk and Scope, How to Effectively Manage Your Next Engineering Project, What is Project Management in Engineering | MEML@Rice, Dynamic Project Management for Major Engineering Projects"
Computer Security and Systems Management,"systems management, computer security","Systems management, What Is IT Systems Management? Definition ..., Systems management, BS in Information Systems Management Online & On-site ..., Systems Management | Dell US, Systems Manager Careers : Education Requirements & ..., Major in Information Systems Management, Importance of IT Service Manage System, Systems Management & Monitoring Software, What Is Computer Security? (And Why It's Important), Computer security, Computer Security Tips, How To Make Your Home Computer Security Unbreakable, The Best Security Suites for 2024, Computer security | Definition & Facts, Information Security Analysts, Computer Security Best Practices - UW Department of Chemistry, NIST Computer Security Resource Center | CSRC"
Advanced Python Scripting for Cybersecurity,"advanced python scripting, cybersecurity","Advanced Python Tutorials, Advanced Python Scripting for ArcGIS Pro, Advanced Python Topics Tutorial, Advanced Python Scripting for Cybersecurity Specialization, 13 Advanced Python Scripts For Everyday Programming, 10 Advanced Python Concepts to Improve Your Python Skills, Looking for recommendations for advanced Python 3 courses, Learn Advanced Python 3, Advanced Python Scripting for Cybersecurity, Cybersecurity Best Practices, What is Cybersecurity?, What is Cyber Security? The Different Types of Cybersecurity, Computer security, Cybersecurity Framework | NIST, Cybersecurity, Cybersecurity"
Computer Forensics,computer forensics,"What is Computer Forensics?, What is Computer Forensics?, Computer Forensics, Computer Forensics Career Guide: Salary & Jobs in ..., Computer forensics, Computer forensics degree: The key to a thriving career, RITx: Computer Forensics, What is computer forensics? | Definition from TechTarget, Become a Computer Forensics Investigator"
Marketing Digital,marketing digital,"What Is Digital Marketing? Types and Examples, What is Digital Marketing? Types, Examples and Benefits, Online Marketing: The Who, What, Why, & How of Digital ..., What Is Digital Marketing? Types, Strategies & Best Practices, What Is Digital Marketing? Your Ultimate Guide, What is Digital Marketing?, Digital marketing, The Ultimate Guide to Marketing Strategies & How ..., The Ultimate Guide to Digital Marketing"
Web3 and Blockchain in Global Commerce,"global commerce, web3, blockchain","Global Commerce, Global Commerce, Global Commerce ï¿½ï¿½ï¿½ Your Global Partner, Global E-Commerce is Global-e, Global Commerce Track - B.S. in Commerce | UVA, Global Commerce Media - Commerce Content Excellence, Global Commerce and Policy, MA - Schar School, About | Global Commerce, M.S. in Global Commerce, Global Commerce: Why and How To Sell Overseas (2024), What Is Web3?, What is Web3 technology (and why is it important)?, Web3 Foundation: W3F, Web3 Explained: The Future of the Internet, Web 3.0 Explained, Plus the History of Web 1.0 and 2.0, What Is Web 3.0 (Web3)? Definition, Guide and History, What Is Web3 All About? An Easy Explanation With ..., Blockchain.com | Be early to the future of finance, Blockchain, Blockchain Facts: What Is It, How It Works, and How It Can ..., Understanding Blockchain Technology - Cryptocurrency, Blockchain Specialization [4 courses] (UBuffalo), Blockchain.com: Crypto Wallet - Apps on Google Play, What Is Block"
Responsive Website Development and Design,"responsive website development, design","Responsive Web Design: What It Is And How To Use It, HTML Responsive Web Design, Responsive design - Learn web development | MDN, The Beginner's Guide to Responsive Web Design in 2024, 11 Powerful Examples of Responsive Web Design, Responsive web design basics | Articles, Responsive web design, Responsive Web Design Introduction, What Is Responsive Web Design? And How to Get Started, Design, Logo, Graphic & AI Design | Design.com, Canva: Visual Suite for Everyone, Microsoft Designer - Stunning designs in a flash, Design, What is design?, Design*Sponge, DESIGN | definition in the Cambridge English Dictionary, award-winning graphic design software"
Learning MEAN Stack by Building Real world Application,"building real world application, learning mean stack","Building a Real-world C# Application, How to Build Real World Web Applications with Couchbase, How do you Learn to Build Substantial, Real-World Apps?, LLMOps: Building Real-World Applications With Large ..., Building Real-World Web Applications with Vue.js 3 ..., Learning MEAN Stack by Building Real world Application ..., Building-Real-world-Web-Applications-with-Vue.js-3 ..., How I built a real world project for the first time, Learning MEAN Stack by Building Real world Application ..., How To Use The MEAN Stack: Build A Web Application ..., Best Online MEAN Stack Courses and Programs, Top MEAN Stack Courses Online - Updated [May 2024], How to learn MEAN stack, Learn About MEAN Stack: A Perfect Guide, 5 Best Online Courses to learn MEAN Stack in 2024"
Cyber Incident Response,cyber incident response,"Cybersecurity Incident Response, Cyber Incident Response, What Is Incident Response?, What is Incident Response? Definition and Complete Guide, Computer Security Incident Handling Guide, How to Design a Cyber Incident Response Plan, What is Incident Response?, NIST Incident Response Plan: Building Your IR Process, Cybersecurity Incident Management and Response Guide"
Academic Skills for University Success,"university success, academic skills","University Success - Adult English Language Learning, University Success Reading Advanced, Student Book with ..., University Success Advanced, University Success Intermediate, University Success NEW, Success - University of Northern Iowa, Success | Leahy Community Health and Family Center, University Success, Understanding University Success. A Report from Standards ..., Academic Skills: Definition, Examples, How To Improve Them, 106 Academic Skills Examples (2024), Academic Skill Handouts, Academic Skills Resources - Student Learning Programs, List of Academic Skills You Need to Improve, Academic Skills Classes, Academic Skills - Current students - The University of Melbourne"
Learn English,learn english,"British Council: Learn English Online, Learn English Online at USA Learns, Learn English with EnglishClass101.com, Cambridge English | Learning English, Learn English Free - English Learning Online, Voice of America - Learn American English with VOA Learning ..., Learn English Free Online, USA Learns Homepage"
Materials Science for Technological Application,"technological application, materials science","What is Technology Application, 10 Technological Applications In 21st-Century Job, Technology Applications, How technology applications drive business growth, Chapter 4: Technology Applications, Technology in Schools, TECHNOLOGICAL APPLICATION collocation | meaning and ..., Technology Applications and Implications, 20 Types of Technology: Definitions and Examples, Technology Application - an overview | ScienceDirect Topics, Materials science, What is Materials Science and Engineering?, Materials Science, Materials Engineers : Occupational Outlook Handbook, Materials science | Definition, Types, Study, & Facts, Materials Sciences | PNNL, Materials Science and Engineering: A | Journal, What is Materials Science and Engineering?"
"Build Website with HTML, JavaScript, AngularJS, and React","build website, react, javascript, html, angularjs","Website Builder ï¿½ï¿½ï¿½ Create a Website in Minutes ï¿½ï¿½ï¿½ Squarespace, The 8 best free website builders in 2024, Website Builder - Create a Free Website, Wix.com: Website Builder - Create a Free Website Today, Free Website Builder: Build a Free Website or Online Store ..., Website Builder | Create a Free Website in Minutes, How to make a website for free/myself/on my own?, Webflow: Create a custom website | Visual website builder, React, React ï¿½ï¿½ï¿½ A JavaScript library for building user interfaces, Getting Started, What is React, REACT, React Definition & Meaning, React Tutorial, Learn JavaScript Online - Courses for Beginners - javascript ..., JavaScript - MDN Web Docs - Mozilla, JavaScript Tutorial, JavaScript, JavaScript basics - Learn web development | MDN, The Modern JavaScript Tutorial, What is JavaScript? - Learn web development | MDN, HTML Tutorial - W3Schools, HTML, HTML: HyperText Markup Language - MDN Web Docs, HTML For Beginners The Easy Way: Start Learning HTML ..., HTML basics - Learn MDN, HTML Standard, HyperText Markup Language (HTML): What It Is, How ..., AngularJS ï¿½ï¿½ï¿½ Superheroic JavaScript MVW Framework, Introduction to AngularJS, AngularJS, Angular, AngularJS: The Complete Guide for Beginners, Discontinued Long Term Support for AngularJS, AngularJS Tu"
Waves and Optics,"waves, optics","Waves Audio - Mixing, Mastering & Music Production Tools, Waves (2019), Waves (film), Watch Waves, Waves, Waves, Optics, Optics | History, Applications, & Facts, OpticsPlanet | Hunting, Shooting, Personal Protection ..., Optics Definition & Meaning, Vortex Optics - Home, Optics for Shooting & Gun Optics, optics.org - The Business of Photonics, Edmund Optics: Optics Manufacturer & Supplier | Imaging ..., VSP Optics, Riton Optics Scopes, Red Dots and Binoculars - Riton Optics"
IT Support Google,support google,"Google Help, Account support, Support Hub | Google Cloud, Google Customer Service Phone Number (866) 246-6453 ..., Contact Us, Google IT Support Professional Certificate, Google IT Support Certificates"
Esports,esports,"Esports, esports.com - Everything else is just Gaming!, Esports Part 1: What are Esports?, LoL Esports, eSports: The sport of the digital generation, Esports Insider: The Latest Esports Industry News, IESF | The home of Esports, Esports Entertainment Group: Home, What is eSports? History, Top Teams, Revenues and Risks"
Startup Entrepreneurship,startup entrepreneurship,"Strategy for Start-ups, How to Start a Startup in 9 Easy Steps, Entrepreneurial Startups, What Is A Startup, What is a Startup: Types and Ideas, What Is A Startup? (With Definition, Types And Advantages), Startup Entrepreneurship Specialization [4 courses] (TIIT), Entrepreneurship, Startups, and Business Formation Are ..., Startup UCLA | UCLA's Place for Entrepreneurship"
Python: A Guided Journey from Introduction to Application,"guided journey, python, introduction, application","Overview of Guided Journeys, A Guided Journey | Public Health, A Guided Journey, BRETT SHELDON, LCSW: Owner and Supervisor, Guided Journey Counseling Center: Home, Guided Journeys, Plus Guided Journey | The Law School Admission Council, Guided Journey Counseling & Consulting, LLC, Guided Journey - Workbook Only, Welcome to Python.org, Python (programming language), Python Tutorial, Online Python - IDE, Editor, Compiler, Interpreter, Python, Online Python Compiler (Interpreter), Learn Python - Full Course for Beginners [Tutorial], INTRODUCTION Definition & Meaning, Introduction (writing), Introduction Definition & Meaning, How to Write an Introduction, With Examples, Introductions - UNC Writing Center, Introduction - Definition, Meaning & Synonyms, Writing a Good Introduction, INTRODUCTION Synonyms: 33 Similar and Opposite Words, INTRODUCTION definition | Cambridge English Dictionary, How to Write an Introduction: A Simplified Guide, Application Definition & Meaning, Apply to college with Common App | Your future starts here, What Is an Application? Definition ..., App Store, Common App: Login, Application software, APPLICATION Definition & Meaning, APPLICATION | definition in the Cambridge English Dictionary, APPLICATION definition in American English"
