Name,Keywords,Result
Machine Learning for Trading,"machine learning, trading","Machine learning, What Is Machine Learning (ML)?, Machine learning, explained, What is Machine Learning? Definition, Types, Tools & More, What Is Machine Learning? Definition, Types, and Examples, Machine Learning Tutorial, Machine Learning Crash Course with TensorFlow APIs, Supervised Machine Learning: Regression and Classification, What Is Machine Learning and How Does It Work?, Trading: Essential Info for Buying and Selling Securities, TradingView ï¿½ï¿½ï¿½ Track All Markets, 10 Day Trading Tips and How to Get Started, Introducing Schwab Trading Powered by Ameritrade, Trade, Commodity Futures Trading Commission | CFTC, Interactive Brokers LLC: Home, Robinhood: Commission-free Stock Trading & Investing App, What is Trading and How Does It Work? | IG Interna"
"TESOL Certificate, Part 2: Teach English Now!","tesol certificate, teach english, part 2","TESOL Certification | Teach English Abroad & Online, TESOL Certificate Teaching English to Speakers of Other ..., What Is TESOL? Which Certification Is Better - TEFL or TESOL?, On-Demand & Facilitated, Arizona State University TESOL Professional Certificate, TESOL Certification, Teach English Online and Abroad, How To Get Online TESOL Certification So You Can Teach ..., Teaching English to Speakers of Other Languages (TESOL), TESOL | International Association, 120-hour Online TEFL/TESOL Certificate, Teach English Online | VIPKid, How to Teach English Online & Get Paid in 2024, Teaching English resources and qualifications, 13 Companies That Let You Teach English Online Without ..., 8 amazing companies that let you teach English online ..., Teach Abroad Programs | Find ESL Jobs Overseas, TeachingEnglish | British Council, The Ultimate Guide to Teaching English in the U.S. - CIEE, Teach English Abroad - English Teacher Jobs - CIEE, Teach English Online (Now Hiring), Shop women clothing at the official Part Two shop, Dune: Part Two (2024), Dune: Part Two, Dune: Part Two, Watch Rebel Moon ï¿½ï¿½ï¿½ Part Two: The Scargiver, pt.2:, 'Dune: Part Two' Cast Test How Well They Know Each Other ..., Watch Dune: Part Two (Bonus X-Ray Edition) | Prime"
Web Design for Everybody: Basics of Web Development & Coding,"web development, web design, everybody, coding, basics","The Beginner's Guide to Website Development, Web development, Web Development Roadmaps, Web Development, What Is Web Development? (2024 Guide), Web Development, Top Web Development Courses Online - Updated [May 2024], Getting started with the web - Learn web development, Learn web development - MDN Web Docs - Mozilla, Learn web development, Website Design | Design a Website That Sets You Apart, What is Web Design? | IxDF, Web design, Web Design Courses & Tutorials, 10 Principles Of Good Web Design, Toronto's Best Web Designers, Top Web Designers in Toronto - May 2024 Reviews, Web Design Toronto | Parachute Design Group Inc., The Leader in Website Design"
Software Design and Architecture,"software design, architecture","Software design, Software Design Process - Software Engineering, Software Design Basics, Why Software Design Is Important, Software Design and Architecture Specialization, Software design pattern, Basics of Software Design | Scaler Topics, Introduction of Software Design Process - Set 2, Software Design (2nd Edition): Budgen, David, Architecture, Architecture | Definition, Techniques, Types, Schools ..., architecture archives, Home | Architecture, Architecture and Design News, Architecture | Tag, Architecture news and projects, Architecture Sarasota, Architecture 2030"
Financial Analysis - Skills for Success,"financial analysis, success, skills","Financial Analysis: Definition, Importance, Types, and ..., What is Financial Analysis? Types & Examples, Overview, Guide, Types of Financial Analysis, Introduction to Financial Analysis - Open Textbook Library, Fundamentals of Financial Statement Analysis, Financial Statement Analysis: How It's Done, by ..., Financial analysis, Introduction to Financial Analysis - Online MBA program, SUCCESS | Your Trusted Guide to the Future of Work, Success Definition & Meaning, SUCCESS | definition in the Cambridge English Dictionary, SUCCESS Definition & Meaning, Success, 57 Synonyms & Antonyms for SUCCESS, How to Be Successful in Life: 9 Psychological Strategies, SUCCESS Synonyms: 79 Similar and Opposite Words, How Do You Define Success?, ACT Success for Organizations, 101 Essential Skills to Put on a Resume in 2024 [For Most ..., Skill Definition & Meaning, 10 Best Skills To Put On Your Resume (With Examples and ..., 120 Essential Skills To List on a Resume, SkillsUSA: Home, Skill, 11 Essential Soft Skills In 2024 (With Examples), Writing a Resume Skills Section: Top Skills to Include & ..., Skills for Resume: Essential Examples Across Professions, Skills"
Investment Management,investment management,"Investment Management: More Than Just Buying and ..., Investment Management, Division of Investment Management, Investment Management, Investment management, What is Investment Management? Types, Career, & How It ..., Charles Schwab | A Modern Approach to Investing and ..., Morgan Stanley Investment Management"
Blockchain,blockchain,"Blockchain.com | Be early to the future of finance, Blockchain, Blockchain Facts: What Is It, How It Works, and How It Can ..., Understanding Blockchain Technology - Cryptocurrency, Blockchain: Opportunities for health care, What Is Blockchain?"
Microsoft Azure AI Fundamentals AI-900 Exam Prep,"microsoft azure ai fundamentals ai, 900 exam prep","Microsoft Certified: Azure AI Fundamentals - Certifications, Microsoft Azure AI Fundamentals: AI Overview - Training, Fundamental AI Concepts - Training, Course AI-900T00-A: Microsoft Azure AI Fundamentals, Microsoft Azure AI Fundamentals AI-900 Exam Prep ..., Study guide for Exam AI-900: Microsoft Azure ..., Prepare for the Microsoft Azure AI Fundamentals (AI-900) ..., Top AI-900: Microsoft Azure AI Fundamentals Courses Online, Microsoft Azure AI Fundamentals, Study guide for Exam MS-900: Microsoft 365 Fundamentals, Study guide for Exam AZ-900: Microsoft Azure Fundamentals, Microsoft Azure Fundamentals AZ-900 Exam Prep ..., AZ-900 Exam Prep: Mastering Azure Fundamentals, Microsoft AZ-900 Certification with Actual Free Questions, AZ-900 Exam Preparation: Microsoft Azure Fundamentals, Microsoft Azure Fundamentals (AZ-900) Exam Prep, Top AZ-900: Microsoft Azure Fundamentals Courses Online, AZ-900 Free Azure Exam Questions & Answers"
Healthy and Sustainable Foods and Products,"sustainable foods, products, healthy","Top 10 sustainable foods, 6 of the Most Sustainable Foods in the World, Sustainability | The Nutrition Source - HSPH.Harvard.edu, What is sustainable food?, Most Sustainable Foods and How to Eat Sustainably, Eight tips to eat more sustainably - WWF-UK, Eat this to save the world! The most sustainable foods, 50 Most Sustainable Foods for a Planet-Friendly Plate, 10 Most Sustainable Foods & Ingredients, Product (business), Browse All of Google's Products & Services, What Is a Product? (+ Tips for Creating a Lovable Product), PRODUCT | definition in the Cambridge English Dictionary, Products, Products and Services - Definitions, Examples, Differences, Consumer Reports: Product Reviews and Ratings, Product Definition & Meaning, Product - Definition, Meaning & Synonyms, In our products, Healthy Definition & Meaning, Healthy Eating Plate | The Nutrition Source - HSPH.Harvard.edu, Healthy People 2030, HEALTHY | definition in the Cambridge English Dictionary, HEALTHY Definition & Meaning, Healthy diet, Healthy - Definition, Meaning & Synonyms, 50 Foods That Are Super Healthy, The Healthy @Reader's Digest: Healthy Living with Expert ..., Healthy Eating for a Healthy Weight"
"Food Sustainability, Mindful Eating, and Healthy Cooking","mindful eating, healthy cooking, food sustainability","Mindful Eating | The Nutrition Source | Harvard T.H. Chan ..., 6 Ways to Practice Mindful Eating, Mindful Eating: The Art of Presence While You Eat - PMC, Mindful Eating 101 ï¿½ï¿½ï¿½ A Beginner's Guide, 8 steps to mindful eating, How to Practice Mindful Eating, Mindful Eating, Mindful Eating, Mindful Eating: A Guide to Rediscovering a Healthy and ..., EatingWell: Healthy Recipes, Healthy Eating, Our 50 Most-Popular Healthy Recipes, 30 healthy dinners you can cook in 30 minutes or less, Healthy cooking tips and recipe suggestions, 95 Easy Better-For-You Dinners You'll Actually Look ..., 5 Easy Steps to Healthy Cooking: 500 Recipes for Lifelong ..., 107 Healthy Dinners That Are Ready in 40 Minutes or Less, Sustainability | The Nutrition Source - HSPH.Harvard.edu, Food Sustainability, Food Sustainability in the Context of Human Behavior - PMC, Definitions: Sustainability and Food Systems, Food sustainability: Challenges and strategies, Food Sustainability Index, Food Sustainability - Food History - Research Guid ..., Exploring food sustainability"
Academic English: Writing,"academic english, writing","Academic English, What is academic English?: Developing ... - Help Centre, What Is the Difference Between Social and Academic ..., Academic English: Writing Specialization, Definition of Academic English, Academic English for International Students & EAP Teachers, University of Washington Academic English Program - Seattle, Academic English Now ï¿½ï¿½ï¿½ Helping You Write High-Impact ..., Academic English Program (AEP) | Texas Global, Writing.Com, Writing | History, Styles, Types, Importance, & Facts, Writing Guide: Tips to Hone Your Writing Skills, Basics: Writing, The Writing Process | Wingspan: Center for Learning and ..., Purdue OWL - Purdue University, Writing - Simple English Wikipedia, the free encyclopedia, How to Write (with Pictures), Writing Definition & M"
Probabilistic Graphical Models,probabilistic graphical models,"Probabilistic Graphical Models Specialization, Probabilistic Graphical Models 1: Representation, Probabilistic Graphical Models: Principles and Techniques ..., Probabilistic Graphical Models, CS 228 - Probabilistic Graphical Models, 10-708 ï¿½ï¿½ï¿½ Probabilistic Graphical Models, CS 228 - Probabilistic Graphical Models, Introduction to Probabilistic Graphical Models, Graphical Models - UBC Computer S"
Real-World Product Management,"world product management, real","Product Management World: Home Page, Real-World Product Management Specialization, World Product Day, ProductWorld ï¿½ï¿½ï¿½ Product Management Conference ï¿½ï¿½ï¿½ SF Bay ..., How many Product Managers are in the World?, Product Management in Practice: A Real-World Guide to ..., Product managers for the digital world, Product Management A-Z: Hands-On, Real-World ..., What does a global product manager do?, The World of Product Management, Real Definition & Meaning, Home to the video player and downloader, RealPlayer ..., The Real ï¿½ï¿½ï¿½ A Daytime Talk Show with co-hosts Adrienne ..., The RealReal: Buy & Sell Designer Clothes, Bags, Shoes ..., REAL Definition & Meaning, Real - Definition, Meaning & Synonyms, Real, Zeera: Home, REAL | definition in the Cambridge English Dictionary, REAL definition i"
Photography Basics and Beyond: From Smartphone to DSLR,"photography basics, smartphone, dslr, beyond","Photography Basics: The Complete Beginner's Guide, Photography Basics ï¿½ï¿½ï¿½ A Beginner's Photography Guide, Photography for beginners: master the basics, Photography for Beginners Guide, Camera Basics and Photography for Beginners, Photography Basics and Beyond - Coursera, Advice for someone struggling to learn photography basics, Photography for Beginners (The Ultimate Guide for 2024), The best phones to buy in 2024, Smartphone, Cell Phones: Shop the Top Smartphones Online, The Best Phones for 2024, What Is a Smartphone? | Definition from TechTarget, Smartphone Definition & Meaning, The best phone 2024: top smartphones in the US ..., The 2 Best Budget Android Phones of 2024, DSLR Cameras, Digital single-lens reflex camera, DSLR Cameras, DSLR Cameras | SLR Camera - B&H Photo, The best DSLR camera for 2024 - TechRadar, Best DSLR cameras 2024: Top full-frame and crop ..., What even is the point in dslrs anymore? : r/photography, DSLR Cameras: Electronics, What is a DSLR camera for beginners, Canon DSLR CameOS Digital Cameras, Beyond, Inc., Beyond Meat: Vegan Meat, Plant Based Meat Substitutes, Beyond Definition & Meaning, Get Beyond: Business Tools and Services, Beyond Clothing | Expedition Layering Systems, Beyond (TV Series 2016ï¿½ï¿½ï¿½2018), Leon Bridges - Beyond (Official Video), Beyond Burger | Vegan Burger Patties, Menu - Beyond Juicery & "
Meta AR Developer,meta ar developer,"Meta AR Developer Professional Certificate, AR Jobs and VR Jobs, Online Course: Meta AR Developer from Meta, AR Studio in open beta - Meta for Developers, Meta Spark Studio - Create Immersive AR Experiences, Augmented Reality Blog Articles - Meta for Developers, Meta AR Developer Professional Certificate, Reality Labs"
Robotics,robotics,"Robotics, What Are Robots? Robotics Definition & Uses., International Federation of Robotics, VEX Robotics: Home, Agility Robotics, Robotics - Overview | Occupational Safety and Health ..., What Is Robotics? | Definition and Popular Examples, What Is Robotics? | Definition from WhatIs, FIRST Robotics, Hai Robotics: Next-gen Warehouse Automation with ACR ..."
Medical Terminology,medical terminology,"A-Z of medical terms, 75 Must-Know Medical Terms, Abbreviations, and Acronyms, Online Medical Terminology Course, Medical Terminology for Health Professions, Spiral bound ..., Dictionary of Medical Terms, Medical Dictionary of Health Terms: A-C, Medical Terminology for Healthcare Professions, Medical Dictionary"
Web Applications for Everybody,"web applications, everybody","Web application, What is Web Application (Web Apps) and its Benefits, What Is a Web App? A Beginner's Guide, What is a Web Application?, What Is a Web Application? (With Benefits and Jobs), Web app | Definition, History, Development, Examples ..., UM Web Applications, What is a Web Application? Definition, Benefits ..., Nicki Minaj - Everybody (feat. Lil Uzi Vert) [Official Audio], Backstreet Boys - Everybody (Backstreet's Back) (Lyrics), Everybody Definition & Meaning, Nicki Minaj - Everybody, EVERYBODY, EVERYBODY Definition & Meaning, Madonna - Everybody (Official Video) [HD], Logic - Everybody (Official Audio), Everybody (Madonna song)"
Databases for Data Scientists,"data scientists, databases","Data Scientists : Occupational Outlook Handbook, What Is a Data Scientist? Salary, Skills, and How to ..., What Data Scientists Really Do, According to 35 Data ..., What is a Data Scientist? What Do They Do?, Data Scientists: Pioneers in the Evolution of Data Analysis, How to Become a Data Scientist in 2024: Complete Guide, Data Scientist Overview - Best Jobs, How to Become a Data Scientist, Data Scientists, What is Data Science?, Database, Database | Definition, Types, & Facts, Databases: Library of Congress Electronic Resources Online ..., Databases for Research & Education, Articles & Databases | The New York Public ..., A-Z Databases, What is a Database? Everything You Need to Know, What is a Database? | Definition from TechTarget, What is a Database? - Uses, How it Works & Components"
Rust Programming,rust programming,"Rust Programming Language, Rust (programming language), Introduction - The Rust Programming Language, The Rust programming language absolutely positively sucks, What is Rust and why is it so popular?, A Gentle Introduction to Rust"
Biostatistics in Public Health,"public health, biostatistics","What is public health?, What is Public Health?, Introduction to Public Health|Public Health 101 Series|CDC, American Public Health Association ï¿½ï¿½ï¿½ For science. For action ..., Johns Hopkins Bloomberg School of Public Health, Public health, Department of Public Health, 10 Essential Public Health Services, CDPH Home, Home | Powerful ideas for a healthier world, Biostatistics, Biostatistics | Oxford Academic - Oxford University Press, Biostatistics - Johns Hopkins Bloomberg School of Public Health, What is Biostatistics?, Master of Science in Biostatistics - USC Keck School of Medicine, What Does Biostatistics Mean To Us - PMC, Biostatistics | Yale School of Public Health, Department of Biostatistics | Harvard T.H. Chan School of ..., Biostatistics | University of Michigan School of Public "
Object Oriented Programming in Java,"object oriented programming, java","Object-oriented programming, What Is OOP (Object Oriented Programming)?, Introduction of Object Oriented Programming, What is the point of Object Oriented programming?, Object-oriented programming - Learn web development | MDN, What is object-oriented programming? OOP explained in ..., Object-oriented Programming in 7 minutes | Mosh, Object-Oriented Programming (C#), Object-Oriented Programming, Java | Oracle, Java Downloads, Java (programming language), Java, r/Java, Java Tutorial, Learn Java"
Fundamentals of Accounting,"fundamentals, accounting","Fundamental Definition & Meaning, What Are Fundamentals? Types, Common Analysis Ratios, ..., FUNDAMENTAL Synonyms: 148 Similar and Opposite Words, Fundamentals: Ten Keys to Reality: Wilczek, Frank, The Fundamentals: Thoughtfully designed kitchenware ..., FUNDAMENTAL Definition & Meaning, 93 Synonyms & Antonyms for FUNDAMENTAL, FUNDAMENTALS definition | Cambridge English Dictionary, FUNDAMENTAL | definition in the Cambridge English Dictionary, FUNDAMENTAL definition in American English, Accounting, Accounting - Seneca Polytechnic, Toronto, Canada, Accounting Explained With Brief History and Modern Job ..., Accounting and Finance - School of Graduate Studies, CPA Canada, Accounting 101: Accounting Basics for Beginners to Learn, What Is Accounting? Definition, Types, History, & Examples, What Does an Accountant Do?, What is Accounting and Why it Matters For Your Business"
Healthcare IT Support,"support, healthcare","Support Definition & Meaning, SUPPORT | definition in the Cambridge English Dictionary, Official Apple Support, SUPPORT Definition & Meaning, SUPPORT Synonyms: 318 Similar and Opposite Words, Google Help, Microsoft Support, Apple Support on the App Store, Support - Definition, Meaning & Synonyms, Support Definition & Meaning | Britannica Dictionary, HealthCare.gov: Still need health insurance?, Health Care - Healthy People 2030, GE HealthCare | GE HealthCare (United States), Health care, UnitedHealthcare: Health insurance plans, HCA Healthcare: Giving People A Healthier Tomorrow, Occupational Outlook Handbook > Healthcare"
SAS Programmer,sas programmer,"SAS Programmer Professional Certificate, SAS Programming, SAS Programmer Jobs, Employment, 10000+ Sas Programmer jobs in United States (993 new), SAS Global Certification, Top 54 Remote SAS Programmer Jobs, Employment, Sas Programmer: What Is It? and How to Become One?, Base Programming Specialist, What Do SAS Programmers Do: Daily Work & Skills"
The Singer Songwriter,singer songwriter,"Singer-songwriters | Music, Poetry & Storytelling, How do you define the genre 'singer-songwriter'? Why ..., The 100 Greatest Songwriters of All Time, The Ultimate Singer-Songwriter Showdown: A Data-Driven ..., Genres: History: The Singer/Songwriter, Introducing the Ultimate Genre Guide: Singer-Songwriter, Indie Folk & Singer Songwriter 24/7 Live Radio ï¿½ï¿½ï¿½ Coffeehouse ..., Singer/Songwriter - College of Arts & Media - CU Denver, List of singer-songw"
Dynamic Public Speaking,dynamic public speaking,"Dynamic Public Speaking Specialization [4 courses] (UW), Essential Skills of Dynamic Public Speaking | Virtual Seminar, How to be a dynamic Public Speaker, public speaking mooc (massive open online course), Dynamic Public Speaking, The Ins and Outs of Dynamic Speaking, Introduction to Public Speaking, Just What is ï¿½ï¿½ï¿½Dynamic Speaking?ï¿½ï¿½ï¿½, To become a powerful public speaker master the"
Google IT Support,"support, google","Support Definition & Meaning, SUPPORT | definition in the Cambridge English Dictionary, Official Apple Support, SUPPORT Definition & Meaning, SUPPORT Synonyms: 318 Similar and Opposite Words, Google Help, Microsoft Support, Apple Support on the App Store, Support - Definition, Meaning & Synonyms, Support Definition & Meaning | Britannica Dictionary, Google, Google - About Google, Our Culture & Company News, The Keyword | Google Product and Technology News and ..., Browse All of Google's Products & Services, Google, Google"
Investment Management with Python and Machine Learning,"machine learning, investment management, python","Machine learning, What Is Machine Learning (ML)?, Machine learning, explained, What is Machine Learning? Definition, Types, Tools & More, What Is Machine Learning? Definition, Types, and Examples, Machine Learning Tutorial, Machine Learning Crash Course with TensorFlow APIs, Supervised Machine Learning: Regression and Classification, What Is Machine Learning and How Does It Work?, Machine Learning for Everybody ï¿½ï¿½ï¿½ Full Course, Investment Management: More Than Just Buying and ..., Investment Management, Division of Investment Management, Investment Management, Investment management, What is Investment Management? Types, Career, & How It ..., Charles Schwab | A Modern Approach to Investing and ..., Morgan Stanley Investment Management, Welcome to Python.org, Python (programming language), Python Tutorial, Online Python - IDE, Editor, Compiler, Interpreter, Python, Online Python Compiler (Interpreter), Learn Python - Full Course for Beginners [Tut"
Bayesian Statistics,bayesian statistics,"Bayesian statistics, Chapter 1 The Basics of Bayesian Statistics, Bayesian Statistics: A Beginner's Guide, Bayesian Statistics: Principles, Models, and Applications ..., Bayesian Statistics the Fun Way, Bayes or not Bayes, is this the question? - PMC, A Gentle Introduction to Bayesian Analysis, Power of Bayesian Statistics & Probability | Data Analysis"
Google IT Support (Deutsch),"support, google, deutsch","Support Definition & Meaning, SUPPORT | definition in the Cambridge English Dictionary, Official Apple Support, SUPPORT Definition & Meaning, SUPPORT Synonyms: 318 Similar and Opposite Words, Google Help, Microsoft Support, Apple Support on the App Store, Support - Definition, Meaning & Synonyms, Support Definition & Meaning | Britannica Dictionary, Google, Google - About Google, Our Culture & Company News, The Keyword | Google Product and Technology News and ..., Browse All of Google's Products & Services, Google, Google, Deutsch agency: Creative. Digital. Design. Media., Deutsch, Deutsch Family Wine & Spirits, DEUTSCH Connectors, deutsch, A multilingual website to learn German for free - deutsch.info, German-English translation for ""deutsch"", Deutsch LA | Home, deutsch, Englische ï¿½ï¿½bersetzung von ï¿½ï¿½ï¿½DEUTSCHï¿"
Human Anatomy and Medical Terminology Fundamentals,"medical terminology fundamentals, human anatomy","Basics, Basic Medical Terminology: 100 Medical Phrases To Know, What is Medical Terminology? [Explanations + Helpful ..., Medical Terminology, Anatomy, and Physiology ..., Basic Medical Terminology, Medical Term | Meaning, Parts & Examples - Lesson, Medical Terminology: Mastering the Basics, 3rd Edition, Human Anatomy and Medical Terminology Fundamentals ..., Anatomy | MedlinePlus, Human body | Organs, Systems, Structure, Diagram, & Facts, Human Anatomy Explorer | Detailed 3D anatomical ..., Human body, human anatomy - Students - Britannica Kids, Human anatomy: Definition and overview of the organs, Human Body - Anatomy and Physiology of ..., 1.1 Overview of Anatomy and Physiology, Human Body 101 | National Geographic"
Marketing Strategy,marketing strategy,"Marketing Strategy: What It Is, How It Works, and How to ..., Marketing Strategy: What It Is and How to Create One, How to Create a Complete Marketing Strategy in 2024 ..., Marketing Strategy 101: A 7-Step Plan for Beginners, Writing a marketing strategy and plan, Making Your Marketing Strategy Work, Marketing Strategies: 17 Examples Plus Tips for Writing One, 8 Marketing Strategy Examples from Inspiring Brands"
Software Architecture for Big Data,"software architecture, big data","Software architecture, Software Architecture Guide, Understanding Software Architecture: A Complete Guide, Software Architecture & Design Introduction, What is Software Architecture?, The Software Architecture Handbook, Software Architecture for faster development & maintenance, Software Architecture in Practice (SEI Series ..., Software Architecture Course by University of Alberta, Big data, Big Data: What it is and why it matters, What is Big Data and Why is it Important?, Big Data Defined: Examples and Benefits, Big Data, Big Data: The Management Revolution, What Is Big Data? Definition, How It Works, and Uses, What Is Big Data?, Definition of Big Data - IT Glossary"
