Name,Keywords,Result
"Concepts, Strategies, and Analytics in Performance Marketing and Digital Advertising","performance marketing, digital advertising, strategies, concepts, analytics","Performance Marketing: A Beginner's Guide to Ecommerce ..., What Is Performance Marketing? Definition and Beginner's ..., How Performance Marketing Works [+ 6 Tools You Can Use], How to Get Started with Performance Marketing, Performance Marketing 101: Everything You Need to Know, How Brand Building and Performance Marketing Can Work ..., What is Performance Marketing?, Performance Marketing: What Is It and How Does It Work?, What is performance marketing - and how to start today, What is digital advertising? A beginner's guide | Amazon Ads, What Is Digital Advertising? Types, Benefits & Examples ..., Digital Advertising Alliance, Types of Digital Advertising, YourAdChoices.com | Welcome to YourAdChoices.com, What is digital advertising? 4 examples to use in your ..., What Is Digital Advertising? A Guide to Getting Started, Digital Advertising 101:Bbeginner's Guide to ..., What Is Digital Advertising? Definition, Types, and Examples, What Is Digital Marketing? Types and Examples, Strategy Definition & Meaning, Strategy, Strategies Coach, What are Strategies? - Student Engagement Project, 35 Synonyms & Antonyms for STRATEGIES, MyTeachingStrategiesï¿½ï¿½ - Log in, Meaning of strategy in English - Cambridge Dictionary, Strategy - Definition, Meaning & Synonyms, What Is Strategy?, Strategies TA supports and inspires cross-sector networks ..., CNCPTS Official Website | Streetwear, luxury fashion, footwear, Concepts App ï¿½ï¿½ï¿½ Infinite, Flexible Sketching, Concept, CNCPTS (@cncpts) ï¿½ï¿½ï¿½ Instagram photos and videos, Concepts: Sketch, Note, Draw - Apps on Google Play, Concept Definition & Meaning, Concepts on the App Store, Analytics Tools & Solutions for Your Business, Google Analytics, Google Analytics Academy, Analytics, Sign in - Google Accounts, Google Analytics | Google for Developers, What is Analytics?, Google Analytics Solutions | Analytics, Analytics Help, Analytics: What it is an"
"Project Management: Tools, Approaches, Behavioural Skills","project management, behavioural skills, tools, approaches","PMI: Project Management Institute, What Is Project Management and What Are the Types?, Project Management: What Is Project Management?, Project management, Your complete guide to project management, Project Management Definition, Basics and Approaches ..., ProjectManagement.com - Home, Top 10 Behavioural Skills, Importance, Training Methods, 8 Behavioral Skills for Increased Job Security, Behavioural skills: definition, importance and examples, Top Behavioral Skills That Employers Value, FAQs About the Importance of Behavioral Skills at Work, What Is the Definition of Behavioral Skills?, 9 Behavioural Skills For Being Successful, Tools, Harbor Freight Tools | Quality Tools, Lowest Prices, Power & Hand Tools | Amazon.com, Best Prices and Top Tool Brands | Tool Nut, Tools - Grainger Industrial Supply, Tools at Lowes.com, Northern Tool - Quality Tools for Serious Work, Acme Tools - Best Online Tool Store, Power Tools, Approach Definition & Meaning, APPROACHES Synonyms: 147 Similar and Opposite Words, APPROACH | definition in the Cambridge English Dictionary, APPROACHES definition in American English, Approach - Definition, Meaning & Synonyms, 148 Synonyms & Antonyms for APPROACH, APPROACH Definition & Meaning, Approach Definition & Meaning | Britannica Dictionary, 148 Synonyms & Antonyms for APPROACHES, APPROACH definition in American English"
Object Oriented Java Programming: Data Structures and Beyond,"object oriented java programming, data structures, beyond","Object Oriented Java Programming: Data Structures and ..., Object Oriented Programming (OOPs) Concept in Java, Object-Oriented Programming in Java ï¿½ï¿½ï¿½ A Beginner's Guide, Lesson: Object-Oriented Programming Concepts, Learn Java: Object-Oriented Programming, What Are OOP Concepts in Java? How They Work and More, Object Oriented Programming in Java, Data Structures Tutorial, Data structure, Introduction to Data Structures, What are Data Structures? - Definition from WhatIs.com, Data Structure and Types, List of data structures, Data Structures Course by University of California San Diego, Data Structures and Algorithms with Visualizations ï¿½ï¿½ï¿½ Full ..., 5. Data Structures ï¿½ï¿½ï¿½ Python 3.12.3 documentation, Introduction to Data Structures and Algorithms, Beyond Definition & Meaning, Beyond, Inc., Beyond Meat: Vegan Meat, Plant Based Meat Substitutes, Get Beyond: Business Tools and Services, Beyond Clothing | Expedition Layering Systems, Beyond (TV Series 2016ï¿½ï¿½ï¿½2018), Beyond Juicery + Eateryement for Vacation Rentals ..., Leon Bridges - Beyond (Official Video)"
Accounting Data Analytics,accounting data analytics,"Accounting & Data Analytics: What You Need To Know, Accounting Data Analytics Specialization [4 courses] (UIUC), Accounting Data Analyst Jobs, Employment, Why data analytics matters to accountants, All About the Four Types of Data Analytics for Accounting, The next frontier in data analytics, Accounting Data Analytics Graduate Certificate | Gies Online, Online Master's in Accounting & Data Analytics - MSU Broad ..., Accounting Data Analytics and Technologies, MS"
Advanced Leadership Skills for the 21st Century,"advanced leadership skills, 21st century","Advanced Leadership: The Eight Significant Principles, Advanced Leadership Skills and Techniques, Advanced Leadership Development Program, Advanced Leadership Skills, Advanced Leadership Skills for the 21st Century ..., Advanced leadership skills (ALS) - Catalyst Training, Advanced Leadership Certificate Program, Advanced Leadership Skills for Managers | Virtual Seminar, Advanced Leadership Skills for the 21st Century Work ..., 21st century, 21st Century Insurance, Please log in to access your policy, Century 21, 21st Century Community Learning Centers Program ... - NJ.gov, The 21st Century and the 3rd Millennium, Car Insurance Quotes Online - Contact Us, 21st Century Community Learning Centers, Business Banking Solutions | 21st Century Bank | Minneapolis ..., 21st Century Leaders"
Patient Safety,patient safety,"Patient safety, Patient safety, Patient Safety, Patient Safety and Quality Improvement, Defining Patient Safety and Quality Care, Patient Safety | CDC, Patient Safety: What You Can Do to Be a Safe Patient | HAI, 10 Patient Safety Tips for Hospitals, National Patient Safety Goals"
FinTech: Finance Industry Transformation and Regulation,"finance industry transformation, regulation, fintech","Next-gen technology transformation in financial services, Finance Digital Transformation: Predictions for 2025, The Digital Transformation Imperative in Financial Services, Finance Transformation: Roadmap, Strategy, Trends & ..., Digital Transformation In Finance Industry: A Complete Guide, Transformation and growth in banking, How New Technologies Will Transform the Future of Finance, Digital Transformation in Finance: Key Trends in 2024, Why most digital banking transformations failï¿½ï¿½ï¿½and how to ..., 6 Reasons for Digital Transformation in Financial Services, Regulation Definition & Meaning, Regulation, Regulation, Illinois Department of Financial & Professional Regulation, regulation | Wex | US Law | LII / Legal Information Institute, Regulatory Actions, REGULATION | definition in the Cambridge English Dictionary, Regulations.gov, REGULATION Definition & Meaning, Regulation | Definitions, Theoretical Approaches, & Facts, Fintech, Financial Technology (Fintech): Its Uses and Impact on Our ..., Fintechech | Federal Trade Commission, What is Financial Technology (FinTech)? A Beginner's Guide, What Is Fintech?"
"Python, Bash and SQL Essentials for Data Engineering","sql essentials, data engineering, python, bash","The Ultimate Guide on SQL Basics, SQL Basics Cheat Sheet, SQL Introduction, 10 essential tools for SQL Server releases and productivity, SQL Essential Training Online Class, Sql Essentials: Randolph, Gary, Griffin, Jeffrey, SQL Basics ï¿½ï¿½ï¿½ Hands-On Beginner SQL Tutorial Analyzing ..., SQL Essentials - Stanford University, SQL Esse"
Managerial Economics and Business Analysis,"managerial economics, business analysis","Managerial Economics Major, Chapter 1: Introduction to Managerial Economics, Managerial Economics, Managerial Economics: 9781118041581, Managerial Economics, What is Managerial Economics: Types, Nature & More, Managerial Economics Major, What is Managerial Economics? | Scope, Concepts, principles ..., Managerial Economics (The Mcgraw-hill Economics Series ..., Business Analysis | The Global Standard | IIBAï¿½ï¿½, Business analysis, What is a Business Analysis and What does ..., Business Analysis, What Is a Business Analyst? 2024 Career Guide, Business Analysis | School of Continuing Studies, Business Analysis | UBC Sauder Continuing Business Studies, Best Online Business Analysis Courses and Programs, What is a business analyst? A key role for business-IT"
Autodesk CAD/CAM for Manufacturing,"autodesk cad, manufacturing, cam","CAD Software | 2D and 3D Computer-Aided Design, Get Prices & Buy Official AutoCAD Software, Autodesk AutoCAD LT 2025 | Get Prices & Buy Official ..., AutoCAD Web App - Online CAD Editor & Viewer | Autodesk., AutoCAD, Download Free Autodesk Software | Free Trials, Autodesk Education & Student Access, CAD Design Software | Computer-Aided Design, AutoCAD, 3D CAD Software for Drawing & Modeling, Manufacturing: Definition, Types, Examples, and Use as ..., What is Manufacturing: The Ultimate Guide (2024) ï¿½ï¿½ï¿½ Katana, Manufacturing USA, What is Manufacturing? (Definition, Types and Examples), The Manufacturing Institute | Workforce development and ..., Manufacturing | NIST, Facts About Manufacturing - NAM, Manufacturing, Manufacturing | Definition, Types, & Facts, Cam ï¿½ï¿½ï¿½ Official Website, Cam (@camcountry) ï¿½ï¿½ï¿½ Instagram photos and videos, Cam Definition & Meaning, Cam (2018), Cam (@camcountry) / X, Cam, CAM ï¿½ï¿½ï¿½ (313) 305-0311, Cam (film), Z CAM: Professional Cinema Ca"
Introduction to Cybersecurity & Risk Management,"risk management, introduction, cybersecurity","What is Risk Management?, Managing Risks: A New Framework, Risk management, Risk Management - Overview, Importance and Processes, What is risk management?, What Does Risk Management Involve? ï¿½ï¿½ï¿½ RiskOptics, What is Risk Management and Why is It Important?, What Is Risk Management & Why Is It Important? - HBS Online, What Is Risk Management in Finance, and Why Is It ..., INTRODUCTION Definition & Meaning, Introduction (writing), Introduction Definition & Meaning, How to Write an Introduction, With Examples, Introductions - UNC Writing Center, Introduction - Definition, Meaning & Synonyms, INTRODUCTION definition | Cambridge English Dictionary, Writing a Good Introduction, INTRODUCTION Synonyms: 33 Similar and Opposite Words, How to Write an Introduction: A Simplified Guide, Cybersecurity Best Practices, What is Cybersecurity?, What is Cyber Security? The Different Types of Cybersecurity, Cybersecurity Framework | NIST, Computer security, Cybersecurity, Cyberse"
Become a Journalist: Report the News!,"report, news, journalist, become","Report Definition & Meaning, Report, Home | RePORT, Report for America: Home Page, Employment Situation Summary - 2024 M04 Results, REPORT | definition in the Cambridge English Dictionary, REPORT Definition & Meaning, AR6 Synthesis Report: Climate Change 2023, Consumer Reports: Product Reviews and Ratings, Report Content On Google - Legal Help, Google News, NBC News - Breaking News & Top Stories - Latest World, US ..., CNN: Breaking News, Latest News and Videos, Fox News - Breaking News Updates | Latest News Headlines ..., ABC News - Breaking News, Latest News and Videos, CBS News - Breaking news, 24/7 live streaming news & top ..., U.S. News & World Report: News, Rankings and Analysis on ..., U.S. and World News Headlines, Journalist, Journalist Definition & Meaning, What does a journalist do?, Meaning of journalist in English - Cambridge Dictionary, News Analysts, Reporters, and Journalists, Society of Professional Journalists - Improving and protecting ..., Journalist Studio, JOURNALIST Definition & Meaning, 27-3023 News Analysts, Reporters, and Journalists, Become Definition & Meaning, BECOME | definition in the Cambridge English Dictionary, Become - Definition, Meaning & Synonyms, Become Clothing, BECOME definition in American English, become.co: Become - Powering Small Business Funding, Become.com - You Shop, We compare.?, BECOME Definition & Meaning, BECOME Synonyms: 21 Similar and Opposite Words, become - Wiktionary, the free dictionary"
Practical Data Science with MATLAB,"practical data science, matlab","Hello! ï¿½ï¿½ï¿½ Practical Data Science, Practical Data Science, Practical Data Science with R, Second Edition, Practical Data Science with R, Practical Data Science with MATLAB Specialization, Practical Data Science with R, Second Edition [Book], Practical Data Science: A Guide to Building the Technology ..., Practical Data Science for Information Professionals - ALA Store, Practical Data Science, Practical Data Science with R: Nina Zumel ..., MATLAB - MathWorks, Matlab, MATLAB Online, MATLAB Documentation, MathWorks - Makers of MATLAB and Simulink - MATLAB ..., What Is MATLAB? - MATLAB & Si"
Differential Calculus through Data and Modeling,"differential calculus, modeling, data","Differential Calculus, Differential calculus, Differential calculus | Derivatives, Limits, Functions, Differential Calculus - Terms, Formulas, Rules, Examples, 8.1: Basics of Differential Equations - Math LibreTexts, Calculus I - Differentials, Differentials - Calculus, How to Get into Modeling, MODELING Definition & Meaning, Model (person), Modeling - Definition, Meaning & Synonyms, Synopsis of Modeling Instruction(TM), Modeling vs. Modelling, Modern Modeling Methods: Home, MODELING | definition in the Cambridge English Dictionary, 3D Design Software | 3D Modeling & Drawing | SketchUp ..., MODELING 101 // HOW TO START MODELING, Data, Data.gov Home - Data.gov, Data Definition & Meaning, What is Data? - Definition from WhatIs.com, OECD Data, World Bank Open Data | Data, Our World in Data, DATA Definition & Meaning, DATA | definition in the Cambridge English Dictionary, IMF Data"
Value-Based Care,"based care, value","Value-based care transforms the patient experience in ..., Value-Based Care, Value-Based Care: What It Is, and Why It's Needed, Value-Based Care Spotlight, Value-Based Care, Understanding Value-Based Care and Its Importance to ..., Value-Based Care - The Health of America, Value-based Care Report, What Is Value-Based Care, What It Means for Providers?, Value Definition & Meaning, VALUE | definition in the Cambridge English Dictionary, VALUE Definition & Meaning, Value - Definition, Meaning & Synonyms, VALUE Definition & Meaning, VALUE definition in American English, Value, VALUE Synonyms: 151 Similar and Opposite Words, Value City Furniture: Designer Looks Without The Designer ..., Value Definition & Meaning | Britannica Dictionary"
Modeling and Control of Power Electronics,"power electronics, modeling, control","Power Electronics, Power electronics, What are Power Electronics? ï¿½ï¿½ï¿½ How it Works, Power Electronics, Definition of Power Electronics, IEEE Power Electronics Society: Home, Power Electronics - Definition, Working, Types and ..., Power Electronics, Power Electronics News - Home, Power Electronics - an overview | ScienceDirect Topics, How to Get into Modeling, MODELING Definition & Meaning, Model (person), Modeling - Definition, Meaning & Synonyms, Synopsis of Modeling Instruction(TM), Modeling vs. Modelling, Modern Modeling Methods: Home, MODELING | definition in the Cambridge English Dictionary, 3D Design Software | 3D Modeling & Drawing | SketchUp ..., MODELING 101 // HOW TO START MODELING, Control (video game), Control - Remedy Entertaiment, Control - Discover a World Unknown, Control Ultimate Edition on Steam, CONTROL Definition & Meaning, Control (2007), Control - PS4 & PS5"
Applied Cryptography,applied cryptography,"Applied Cryptography, Applied Cryptography: Protocols, Algorithms, and Source ..., APPLIED CRYPTOGRAPHY, SECOND EDITION, A Graduate Course in Applied Cryptography, Applied Cryptography, CS 6260: Applied Cryptography - OMSCS - Georgia Tech, Handbook of Applied Cryptography, Applied Cryptography: Protocols, Algorithms and Source ..., Applied Cryptography, Product: Applied Cryptography (Hardcover)"
Tally Bookkeeper,tally bookkeeper,"Tally Bookkeeper Professional Certificate, Join our Bookkeeping and Accounting Professionals Network, Tally Services - Accounting & Bookkeeping in Fort Collins, Tally Bookkeeper - US News SkillBuilder, TallyPrime ï¿½ï¿½ï¿½ Complete Bookkeeping Software for India, Which is better in Coursera, 'Intuit Academy Bookkeeping ..., Tally Bookkeeping Solutions | Bookkeeping Service in Austin ..., Tally Accounting Solutions, Tally Bookkeeper, Tally Bookkeeper - Spanish - Skills A"
Object Oriented Programming,object oriented programming,"Object-oriented programming, What Is OOP (Object Oriented Programming)?, Benefits of OOPs in Java: A Comprehensive Overview, Object-oriented programming - Wikipedia, 4.2. Introduction to Object Oriented Programming - OpenDSA, Should You Learn Object-Oriented Programming Languages? - Coursera, Introduction of Object Oriented Programming, What is the point of Object Oriented programming?, Object-oriented programming - Learn web development | MDN, What is object-oriented programming? OOP explained in ..., Object-oriented Programming in 7 minutes | Mosh, Object-Oriented Programming (C#), Object-Oriented Programming"
Health Information Literacy for Data Analytics,"health information literacy, data analytics","What Is Health Literacy? | Health Literacy, Current Situations and Challenges in the Development ..., An Introduction to Health Literacy, Understanding Health Literacy, Health Literacy in Healthy People 2030, Health Literacy | National Institutes of Health (NIH), Digital Health Literacy | PSNet, Health Literacy - Healthy People 2030, Health Literacy Fact Sheets, Data Analytics: What It Is, How It's Used, and 4 Basic ..., What is data analytics? | Definition from TechTarget, Data Analytics: Definition, Uses, Examples, and More, What is Data Analytics?, What is Data Analytics? A Complete Guide with Demo, What is Data Analytics? A Complete Guide for Beginners, What Is Data and Analytics: Everything You Need to Know, What Is Data Analytics - The Ultimate Guide"
Integrative Nursing,integrative nursing,"Principles of Integrative Nursing, Integrative Nursing: Application of Principles Across ..., Integrative Nursing | Bakken Center for Spirituality & Healing, Integrative Nursing Specialization [5 courses] (UMN), Integrative Nursing - Mary Jo Kreitzer; Mary Koithan, Integrative Nursing Program, Integrative Nursing - Oxford Academic, Nursing Integrative Health Degree | The University of Arizona, The Role of Integrative Care in Nursing, Integrative Nursing: A Framework for Whole-Person Mental ..."
Statistical Modeling for Data Science Applications,"data science applications, statistical modeling","25 Data Science Applications and Examples, Applications of Data Science, Data Science Applications across 10 Industries | Rice MDS, Top 10 Data Science Applications with Examples and Use ..., What is Data Science? A Simple Explanation and More, 18 Data Science Tools to Consider Using in 2024, 10 Real-World Data Science Applications, Top 22 Data Science Applications of 2024, What Is Data Science? 5 Applications in Business - HBS Online, Top 25 Applications Based on Data Science, What Is Statistical Modeling?, Statistical model, What is Statistical Modeling For Data Analysis?, Statistical Modeling, Causal Inference, and Social Science, What is Statistical Modeling?, What is statistical modeling?, Statistical model | Definition, examples, types, Statistical Modelling, What is Statistical Modeling?"
"Power System: Generation, Transmission and Protection","power system, transmission, protection, generation","Power Systems: Fitness Equipment | Strength & Conditioning ..., What Are the Different Electrical Systems and Why They Matter in ..., Electrical System - an overview | ScienceDirect Topics, Components of Electrical Power Systems, eTool : Electric Power Generation, Transmission, and Distribution, Power System Engineering, Inc.: Home, What is Power System? Definition & Structure ..., Electrical Power System - an overview, Electrical Power System Fundamentals for Non Electrical ..., Electricity 101, Electrical grid, Introduction to Electric Power Systems - MIT OpenCourseWare, Power Systems | GE Research, Transmission, Transmission (mechanical device), Transmission Definition & Meaning, Allison Transmission, What Is a Transmission and How Does it Work?, Transmission - Auto Parts, TRANSMISSION Definition & Meaning, Transmission for Cars, Trucks & SUVs, Protection Definition & Meaning, PROTECTION Definition & Meaning, U.S. Environmental Protection Agency | US EPA, Protection, Protection 1 Home Security Company: Alarms, Surveillance ..., Paycheck Protection Program, PROTECTION | definition in the Cambridge English Dictionary, Consumer Financial Protection Bureau, Protection - Definition, Meaning & Synonyms, Advanced Protection Program, Where Millennials end and Generation Z begins, Generation: Home, Generation (TV Series 2021), A Year-by-Year Guide to the Different Generations, Age Range by Generation, Generation Definition & Meaning, Generation Z, GENERATION | English meaning - Cambridge Dictionary"
Deep Learning for Healthcare,"deep learning, healthcare","Deep learning, What is Deep Learning?, Deep Learning - MATLAB & Simulink, Introduction to Deep Learning, Deep Learning Specialization [5 courses] (DeepLearning.AI), Deep Learning, Deep Learning, What is deep learning and how does it work?, What is Deep Learning? - MachineLearningMastery.com, HealthCare.gov: Still need health insurance?, Health Care - Healthy People 2030, Occupational Outlook Handbook > Healthcare, GE HealthCare | GE HealthCare (United States), Health care, UnitedHealthcare: Health insurance plans, HCA Healthcare: Giving People A Healthier Tomorrow"
Introduction to Applied Cryptography,"applied cryptography, introduction","Applied Cryptography, Applied Cryptography: Protocols, Algorithms, and Source ..., APPLIED CRYPTOGRAPHY, SECOND EDITION, A Graduate Course in Applied Cryptography, Applied Cryptography, CS 6260: Applied Cryptography - OMSCS - Georgia Tech, Handbook of Applied Cryptography, Applied Cryptography: Protocols, Algorithms and Source ..., Applied Cryptography, Product: Applied Cryptography (Hardcover), INTRODUCTION Definition & Meaning, Introduction (writing), Introduction Definition & Meaning, How to Write an Introduction, With Examples, Introductions - UNC Writing Center, Introduction - Definition, Meaning & Synonyms, INTRODUCTION definition | Cambridge English Dictionary, Writing a Good Introduction, INTRODUCTION Synonyms: 33 Similar and Opposite Words, How to Write an Introduction: A Simplified Guide"
Sustainable Cities,sustainable cities,"Sustainable Cities, Sustainable Cities, What is a sustainable city? 10 characteristics of green ..., Goal 11: Make cities inclusive, safe, resilient and sustainable, Sustainable city, Sustainable Cities, Goal 11: Sustainable cities and communities, WRI Ross Center for Sustainable Cities"
Leading: Human Resource Management and Leadership,"human resource management, leading, leadership","What is Human Resource Management (HRM)?, HRM | What is Human Resource Management?, Welcome to SHRM | The Voice of All Things Work, Human resource management, What Is Human Resource Management? Definition ..., 1.1 What Is Human Resources?, Human Resources Managers : Occupational Outlook ..., 7 Human Resource Management Basics for Every HR ..., Human Resources (HR): Meaning and Responsibilities, What Is Human Resource Management? | Maryville Online, Leading Definition & Meaning, Leading, LEADING Synonyms: 198 Similar and Opposite Words, LEADING | definition in the Cambridge English Dictionary, LeadingAge, Leading vs. Leadership, 47 Synonyms & Antonyms for LEADING, LEADING Definition & Meaning, Leading - Definition, Meaning & Synonyms, LEADING definition in American English, Understanding Leadership, Leadership Definition & Meaning, What Is Leadership? - How to Lead Your Team Skilfully, What is leadership: A definition and way forward, What Is Leadership? | Definition by TechTarget, Leadership, What is Leadership? Operational Vs. Strategic Leaders, 12 Characteristics of a Good Leader - Ccl.org, Leadership, Leadership"
Introduction to Environmental Science,"environmental science, introduction","Environmental science, Environmental Science Degrees, Careers & Green Jobs, Environmental science | Definition & Facts, Environmental Science Degrees, Environmental Science & Technology - ACS Publications, AP Environmental Science - AP Students - College Board, Environmental Scientists and Specialists, Environmental Science and Pollution Research, What is Earth and Environmental Science?, INTRODUCTION Definition & Meaning, Introduction (writing), Introduction Definition & Meaning, How to Write an Introduction, With Examples, Introductions - UNC Writing Center, Introduction - Definition, Meaning & Synonyms, INTRODUCTION definition | Cambridge English Dictionary, Writing a Good Introduction, INTRODUCTION Synonyms: 33 Similar and Opposite Words, How to Write an Introduction: A Simplified Guide"
