Name,Keywords,Result
AI for Good,"good, ai","Good Definition & Meaning, GOOD Definition & Meaning, GOOD: Inspiring Hope By Storytelling, Explore Culture ..., Good, What is the true meaning of the word 'good'?, GOOD Synonyms: 1341 Similar and Opposite Words, Good (2008), 369 Synonyms & Antonyms for GOOD, GOOD | definition in the Cambridge English Dictionary, ï¿½ï¿½ï¿½ï¿½ï¿½ï¿½ï¿½ï¿½ï¿½ï¿½ï¿½ï¿½ï¿½ï¿½ï¿½ï¿½ï¿½ï¿½ï¿½ï¿½ï¿½ï¿½ï¿½ï¿½ï¿½ï¿½ ï¿½ï¿½ï¿½ï¿½ï¿½ï¿½ï¿½ï¿½ï¿½ï¿½ï¿½ï¿½ï¿½ï¿½ï¿½ï¿½ï¿½ï¿½, AI, ï¿½ï¿½ï¿½ï¿½ï¿½ï¿½ï¿½ï¿½ï¿½ï¿½ï¿½ï¿½ï¿½ï¿½ï¿½ï¿½ï¿½ï¿½ï¿½ï¿½ï¿½ï¿½ï¿½ï¿½ï¿½ï¿½ ï¿½ï¿½ï¿½ï¿½ï¿½ï¿½ï¿½ï¿½ï¿½ï¿½ï¿½ï¿½ï¿½ï¿½ï¿½ï¿½ï¿½ï¿½ (ï¿½ï¿½ï¿½ï¿½, Artificial intelligence, AI), mosmed.ai, OpenAI, Google AI, AI: ï¿½ï¿½ï¿½ï¿½ï¿½ï¿½ ï¿½ï¿½ï¿½ï¿½ï¿½ï¿½ ï¿½ï¿½ ï¿½ï¿½ï¿½ï"
Generative AI Fundamentals,generative ai fundamentals,"Generative AI Fundamentals, Fundamentals of Generative AI - Training, Generative AI Fundamentals Specialization, Google Cloud Generative AI Skill Badge, Introduction to Generative AI | Learn AI Basics, Microsoft Azure AI Fundamentals: Generative AI - Training, Generative AI Fundamentals for Law Firms, Beginner: Introduction to Generative AI Learning Path, New generative AI trainings from Google Cloud"
Microsoft Power BI Data Analyst,microsoft power bi data analyst,"Microsoft Certified: Power BI Data Analyst Associate, Microsoft Power BI Data Analyst Professional Certificate, Course PL-300T00-A: Microsoft Power BI Data Analyst, Power BI Data Analyst Associate certification, is it worth it?, Data Analyst in Power BI, Power BI Data Analyst Certification vs ..., Microsoft Certified: Data Analyst Associate with Power BI, Power BI on Microsoft Learn, How I prepared for the Power BI Data Analyst Certification, Significant changes to PL-300 Microsoft Power BI Data ..."
AI For Business,"business, ai","Small Business Administration, Business Definition & Meaning, Business Insider, business.com: Expert Business Advice, Tips, and Resources ..., What Is a Business? Understanding Different Types and ..., Get Listed on Google - Google Business Profile, Login and Access Meta Business Suite and Business Manager, Businessweek, How To Start A Business In 11 Steps (2024 Guide), ï¿½ï¿½ï¿½ï¿½ï¿½ï¿½ï¿½ï¿½ï¿½ï¿½ï¿½ï¿½ï¿½ï¿½ï¿½ï¿½ï¿½ï¿½ï¿½ï¿½ï¿½ï¿½ï¿½ï¿½ï¿½ï¿½ ï¿½ï¿½ï¿½ï¿½ï¿½ï¿½ï¿½ï¿½ï¿½ï¿½ï¿½ï¿½ï¿½ï¿½ï¿½ï¿½ï¿½ï¿½, AI, ï¿½ï¿½ï¿½ï¿½ï¿½ï¿½ï¿½ï¿½ï¿½ï¿½ï¿½ï¿½ï¿½ï¿½ï¿½ï¿½ï¿½ï¿½ï¿½ï¿½ï¿½ï¿½ï¿½ï¿½ï¿½ï¿½ ï¿½ï¿½ï¿½ï¿½ï¿½ï¿½ï¿½ï¿½ï¿½ï¿½ï¿½ï¿½ï¿½ï¿½ï¿½ï¿½ï¿½ï¿½ (ï¿½ï¿½ï¿½ï¿½, Artificial intelligence, AI), mosmed.ai, OpenAI, Google AI, AI: ï¿½ï¿½ï¿½ï¿½ï¿½ï¿½ ï¿½ï¿½ï¿½ï¿½ï¿½ï¿½ ï¿½ï¿½ ï¿½ï¿½ï¿½ï"
AI For Everyone,"everyone, ai","Everyone Definition & Meaning, Everyone for every body, EVERYONE Definition & Meaning, Body Care Products - Everyone, EVERYONE | definition in the Cambridge English Dictionary, Mitski - Everyone (Official Audio), EVERYONE Synonyms: 11 Similar and Opposite Words, Amazon.com: Everyone, EveryONE - News and research from PLOS ONE, Everyone vs. Every Oneï¿½ï¿½ï¿½What's the Difference, ï¿½ï¿½ï¿½ï¿½ï¿½ï¿½ï¿½ï¿½ï¿½ï¿½ï¿½ï¿½ï¿½ï¿½ï¿½ï¿½ï¿½ï¿½ï¿½ï¿½ï¿½ï¿½ï¿½ï¿½ï¿½ï¿½ ï¿½ï¿½ï¿½ï¿½ï¿½ï¿½ï¿½ï¿½ï¿½ï¿½ï¿½ï¿½ï¿½ï¿½ï¿½ï¿½ï¿½ï¿½, AI, ï¿½ï¿½ï¿½ï¿½ï¿½ï¿½ï¿½ï¿½ï¿½ï¿½ï¿½ï¿½ï¿½ï¿½ï¿½ï¿½ï¿½ï¿½ï¿½ï¿½ï¿½ï¿½ï¿½ï¿½ï¿½ï¿½ ï¿½ï¿½ï¿½ï¿½ï¿½ï¿½ï¿½ï¿½ï¿½ï¿½ï¿½ï¿½ï¿½ï¿½ï¿½ï¿½ï¿½ï¿½ (ï¿½ï¿½ï¿½ï¿½, Artificial intelligence, AI), mosmed.ai, OpenAI, Google AI, AI: ï¿½ï¿½ï¿½ï¿½ï¿½ï¿½ ï¿½ï¿½ï¿½ï¿½ï¿½ï¿½ ï¿½ï¿½ ï¿½ï"
AI Product Management,ai product management,
Deep Learning,deep learning,"Deep learning, What is Deep Learning?, Introduction to Deep Learning, Deep Learning - MATLAB & Simulink, Deep Learning Specialization [5 courses] (DeepLearning.AI), Deep Learning, Deep Learning, Discover Deep Learning: AI's Game-Changing Technology!, What is deep learning and how does it work?"
Generative AI for Everyone,"generative ai, everyone","What is Generative AI? Everything You Need to Know, What is ChatGPT, DALL-E, and generative AI?, Google Generative AI, Generative artificial intelligence, Explained: Generative AI | MIT News, Generative AI ï¿½ï¿½ï¿½ What is it and How Does it Work?, Generative AI Examples, What is Generative AI?, What is generative AI? | IBM Research Blog, Everyone Definition & Meaning, Everyone for every body, EVERYONE Definition & Meaning, Body Care Products - Everyone, EVERYONE | definition in the Cambridge English Dictionary, Mitski - Everyone (Official Audio), EVERYONE Synonyms: 11 Similar and Opposite Words, Amazon.com: Everyone, EveryONE - News and research from PLOS ONE, Everyone vs. Every Oneï¿½ï¿½ï¿½What's th"
Generative AI with Large Language Models,"large language models, generative ai","Large language model, What are Large Language Models? - LLM AI Explained, What Are Large Language Models (LLMs)?, What are Large Language Models?, What is a large language model (LLM)?, What is a Large Language Model? - Elastic, What are Large Language Models(LLMs)?, Introduction to Large Language Models | Machine Learning, What are Large Language Models, Large language models can do jaw-dropping things. But ..., What is Generative AI? Everything You Need to Know, What is ChatGPT, DALL-E, and generative AI?, Google Generative AI, Generative artificial intelligence, Explained: Generative AI | MIT News, Generative AI ï¿½ï¿½ï¿½ What is it and How Does it Work?, Generative AI Examples, What is Generative AI?, What is generative AI? | IBM Researc"
IBM Applied AI,ibm applied ai,"IBM AI Developer Professional Certificate, Badge: IBM Applied AI Professional Certificate - IBM Training, Applied AI with DeepLearning Course by IBM, A Review of IBM Applied AI Professional Certificate ..., Badge: IBM Applied AI Professional Certificate (V3), IBM Applied AI Professional Certificate Online, I took the IBM AI Engineering Professional Certificate on ..., Online Course: IBM Applied AI from IBM, IBM Applied AI Professional Certificate (V2)"
Machine Learning,machine learning,"Machine learning, What Is Machine Learning (ML)?, Machine learning, explained, What Is Machine Learning? Definition, Types, Applications ..., What Is Machine Learning? - MATLAB & Simulink, What Is Machine Learning? Definition, Types, and Examples, What is Machine Learning? Definition, Types, Tools & More, Supervised Machine Learning: Regression and Classification, What is Machine Learning and How Does It Work? In- ..."
Natural Language Processing,natural language processing,"What Is Natural Language Processing?, Natural language processing, What is natural language processing? | Definition from ..., What is Natural Language Processing? Definition and ..., Natural Language Processing (NLP) [A Complete Guide], Natural Language Processing - Overview, What is Natural Language Processing?, The Power of Natural Language Processing, Natural Language Processing (NLP): What Is It & How ..."
Prompt Engineering for ChatGPT,"prompt engineering, chatgpt",
Supervised Machine Learning: Regression and Classification,"supervised machine learning, regression, classification","What Is Supervised Learning?, Supervised learning, Supervised and Unsupervised learning, Supervised Machine Learning, Supervised Machine Learning, Supervised Machine learning, Supervised Learning | Machine Learning, Supervised Machine Learning | DataRobot AI Wiki, Supervised Learning, Regression analysis, What Is Regression? Definition, Calculation, and Example, A Refresher on Regression Analysis, Regression, Linear regression, Regression (2015), 11. Correlation and regression, 7 Regression Techniques You Should Know!, Regression Definition & Meaning, Linear regression calculator, Classification, CLASSIFICATION Definition & Meaning, CLASSIFICATION definition | Cambridge English Dictionary, Classification, Classification - Definition, Meaning & Synonyms, Classification, Classification-Home, CLASSIFICATION definition in American English, Classification | biology"
Google Cybersecurity,google cybersecurity,"Google Cybersecurity Certificate, Google Cybersecurity Professional Certificate, Google Cybersecurity Action Team, Google Cybersecurity Innovations, Google Cybersecurity Certificate, Cybersecurity Workforce Education, I took Google's Cybersecurity Certification and Here's What ..., Is Google's Cybersecurity Certification Worth It? (Deep Dive & ..., Google Cybersecurity Professional Certificate, New cybersecurity training to help build a safer world"
Google Data Analytics,google data analytics,"Google Data Analytics Professional Certificate, Data Analytics Certificate & Training, Google Analytics Academy, Data Analytics Certificate & Training, AI for Data Analytics, Has anyone landed a job after getting Google Data ..., Data Analytics | Google Cloud Blog, Google Advanced Data Analytics Professional Certificate, Analytics Tools & Solutions for Your Business, Is Google Data Analytics Certificate ACTUALLY Worth it 2023?"
Google Digital Marketing & E-commerce,"google digital marketing, e, commerce","Google - Fundamentals of Digital Marketing, Digital Marketing & E-commerce Certificate, Google Digital Marketing & E-commerce Professional ..., Fundamentals of digital marketing : Google - Skillshop, Online Courses and Digital Marketing Training, Google Digital Garage - Skillshop, Google Marketing Platform - Unified Advertising and Analytics, Foundations of Digital Marketing and E-commerce, E! News - E! Online, E! News, E! News (@enews) ï¿½ï¿½ï¿½ Instagram photos and videos, E (mathematical constant), E! News | Los Angeles CA, E! News (@enews) / X, Commerce Bank | Banking, Checking, Savings, Mortgages ..., U.S. Department of Commerce, Commerce, Commerce Definition & Meaning, About Commerce, Commerce: What It Is, How It Differs From Business and ..., U.S. Chamber of Co"
Google IT Automation with Python,"python, google, automation","Welcome to Python.org, Python (programming language), Python Tutorial, Online Python - IDE, Editor, Compiler, Interpreter, Python, Python - Visual Studio Marketplace, Google, Google - About Google, Our Culture & Company News, The Keyword | Google Product and Technology News and ..., Browse All of Google's Products & Services, Google, What Is Automation?, Automation, What is Automation? - ISA, Automation, Automation: The Car Company Tycoon Game, What Is Automation? Definition, Types, Benefits, and ..., Automation | Technology, Types, Rise, History, & Examples, Automation Anywhere: The best AI-Powered Automation ..., Automation Definition & Meaning"
Google IT Support,"support, google","Support Definition & Meaning, Official Apple Support, SUPPORT | definition in the Cambridge English Dictionary, Microsoft Support, Google Help, SUPPORT Definition & Meaning, 334 Synonyms & Antonyms for SUPPORT, Contact - Official Apple Support, Stripe: Help & Support, Support - Definition, Meaning & Synonyms, Google, Google - About Google, Our Culture & Company News, The Keyword | Google Product and Technology News and ..., Browse All of Google's Products & Services, Google"
Google Project Management:,google project management,"Project Management Certificate & Training, Google Project Management: Professional Certificate, Tips for project management - Google Workspace Learning ..., Task management - Google Workspace Marketplace, Purdue Global + Google Project Management Certificate, Will Google Project Management Certificate Actually Lead ..., How I passed the Google Project Management Certificate ..., Google Project Management Professional Certificate"
Google SEO Fundamentals,google seo fundamentals,
Google UX Design,google ux design,"Google UX Design Certificate, Google UX Design Professional Certificate, My Review on Google UX Design Certificate | by Ilma Andrade, What do you guys think about Google UX Design ..., Google User Experience (UX) Certificate, Design - Google Careers, Foundations of User Experience (UX) Design, 1 year after Google UX Design Certificate - Job?, Google UX Design Certificate, ï¿½ï¿½ï¿½ï¿½ LIVE: Google UX Design Certificate "
Intuit Academy Bookkeeping,intuit academy bookkeeping,"Intuit Academy, Intuit Academy Bookkeeping Professional Certificate, Intuit Bookkeeping Certification, Intuit Academy, Intuit Online Courses, To anyone who's taken the Bookkeeping Exam through ..., Become a Bookkeeper in 1 Month or Less (guest QuickBooks ..., Online Course: Intuit Academy Bookkeeping from Intuit, Which is better in Coursera, 'Intuit Academy Bookkeeping ..."
Python for Everybody,"python, everybody","Welcome to Python.org, Python (programming language), Python Tutorial, Online Python - IDE, Editor, Compiler, Interpreter, Python, Python - Visual Studio Marketplace, Nicki Minaj - Everybody (feat. Lil Uzi Vert) [Official Audio], Backstreet Boys - Everybody (Backstreet's Back) (Lyrics), Everybody Definition & Meaning, Nicki Minaj - Everybody, EVERYBODY Definition & Meaning, EVERYBODY | English meaning - Cambridge Dictionary, Everybody (Backstreet's Back), Backstreet Boys - Everybody (Official Video) [4K Remastered], Backstreet Boys - Everybody (Official Audio)"
UI / UX Design,"ux design, ui","What is User Experience (UX) Design? | IxDF, What Is UX Design? The Complete Guide, UX Design: A Complete Guide on What It Is, Google UX Design Professional Certificate, What is UX design? Skills, tools, and advice, User experience design, What Does a UX Designer Actually Do? [2024 Guide], What Does a UX Designer Do?, UI | United Illuminating - UI, Apply and Manage Your Claim Online - EDD - CA.gov, What is User Interface (UI) Design? ï¿½ï¿½ï¿½ updated 2024 | IxDF, Ubiquiti: UniFi - Introduction, Unemployment Insurance, The University of Iowa, What Is a User Interface (UI)? | Definition from Tech"
Meta Front-End Developer,"meta front, end developer","Meta Front-End Developer Professional Certificate, Front-End Developer and Back-End Developer Career ..., Meta's Front End Dev certification worth it? : r/Frontend, Meta Front-End Developer Professional Certificate, Introduction to Front-End Development Course by Meta, ""Meta Front End Developer Professional Certificate ..., Meta Front-End Developer Certificate, Online Course: Meta Front-End Developer from Meta, What Is a Front-End Developer?, What Does a Front-End Developer Do?, What is a Front-End Developer, What Does A Front End Web Developer Do?, Front-end web development, The End of Front-End Development, MDN Curriculum - MDN Web Docs - Mozilla, Front End Developer Skills and Responsibilities, What is Frontend Development?"
Learn SQL Basics for Data Science,"learn sql basics, data science","SQL Tutorial, Learn SQL, SQL Introduction, Best way to learn SQL, Unit 3: Intro to SQL: Querying and managing data, SQL Tutorial - Essential SQL For The Beginners, SQL Tutorial, SQL Tutorial, Data science, What is Data Science?, What is Data Science? - UC Berkeley Online, Best Data Science Courses Online [2024], What is Data Science? A Simple Explanation and More, What Is Data Science? Definition, Examples, Jobs, and More, Data Scientists : Occupational Outlook Handbook, What is Data Science?"
PostgreSQL for Everybody,"postgresql, everybody","PostgreSQL: The world's most advanced open source database, PostgreSQL, What is PostgreSQL? ï¿½ï¿½ï¿½ Amazon Web Services, What Is PostgreSQL?, PostgreSQL Tutorial, PostgreSQL Tutorial, Nicki Minaj - Everybody (feat. Lil Uzi Vert) [Official Audio], Backstreet Boys - Everybody (Backstreet's Back) (Lyrics), Everybody Definition & Meaning, Nicki Minaj - Everybody, EVERYBODY Definition & Meaning, EVERYBODY | English meaning - Cambridge Dictionary, Everybody (Backstreet's Back), Backstreet Boys - Everybody (Official Video) [4K Remastered], Backstreet Boys - Everybody (Official "
Oracle SQL Databases,oracle sql databases,"Database, Database Technologies, SQL Language, Oracle Database, Databases | Oracle Developer, What Is an Oracle Database? - IT Glossary, Introduction to Oracle SQL, SQL Developer, Introduction to Oracle Database, Oracle SQL Databases Specialization"
IBM Data Science,ibm data science,"IBM Data Science Professional Certificate, What is Data Science?, Getting Started with Enterprise Data Science, IBM Data Science Professional Certificate, Jobs in Data & Analytics team | IBM Careers, Badge: Data Science Professional Certificate, IBM Data Analyst Professional Certificate, A Very Subjective Review of IBM's Data Science ..., Data Science Tools & Solutions"
IBM Data Analyst,ibm data analyst,"IBM Data Analyst Professional Certificate, Jobs in Data & Analytics team | IBM Careers, Badge: Data Analyst Professional Certificate, Data, IBM Data Analyst Jobs, Big Data Analytics, IBM - Data Analyst Professional Certificate, IBM Data Analytics with Excel and R Professional Certificate, Total Salary Range for IBM Data Analyst"
IBM DevOps and Software Engineering,"software engineering, ibm devops","What is Software Engineering?, Software engineering, What Does a Software Engineer Do?, What is software engineering?, What Is a Software Engineer? | Skills and Career Paths, Introduction to Software Engineering, Software Developers, Quality Assurance Analysts, and ..., Software Engineering Tutorial, How To Become a Software Engineer: What To Know, Software Engineering Institute, DevOps Solutions, What Is DevOps? | IBM, IBM DevOps and Software Engineering Professional ..., DevOps Accelerate, IBM Applied DevOps Engineering Professional Certificate, DevOps, What is IBM DevOps Automation?, Total Salary Range for IBM Devops Engineer, DevOps for IBM Z"
IBM Full Stack Software Developer,ibm full stack software developer,"IBM Full Stack Software Developer Professional Certificate, Launch a new career path with the IBM Full-Stack ..., IBM - Full Stack Developer Professional Certificate, Courses, IBM Full Stack Software Developer Jobs, IBM Full-Stack JavaScript Developer Professional Certificate, Online Course: IBM Full Stack Software Developer from IBM, Jumpstart your Career in Cloud Application Development, IBM Full Stack Software Developer Professional Certificate"
Introduction to Data Science,"data science, introduction","Data science, What is Data Science?, What is Data Science? - UC Berkeley Online, Best Data Science Courses Online [2024], What is Data Science? A Simple Explanation and More, What Is Data Science? Definition, Examples, Jobs, and More, Data Scientists : Occupational Outlook Handbook, What is Data Science?, INTRODUCTION Definition & Meaning, Introduction (writing), Introduction Definition & Meaning, How to Write an Introduction, With Examples, Introductions - UNC Writing Center, Introduction - Definition, Meaning & Synonyms, Writing a Good Introduction, INTRODUCTION Synonyms: 33 Similar and Opposite Words, INTRODUCTION definition | Cambridge English Dictionary, How to Write an Introduction: A Simplified Guide"
IBM Data Engineering,ibm data engineering,"IBM Data Engineering Professional Certificate, IBM Data Engineering Professional Certificate, IBM Certified Data Engineer - Big Data - IBM Training, Data Engineering Professional Certificate, Introduction to Data Engineering Course by IBM, Badge: Data Engineering Professional Certificate (V2), IBM: Data Engineering Basics for Everyone, IBM Data Engineering Professional Certificate, IBM Data Engineering Certificate Online"
Data Science Fundamentals with Python and SQL,"data science fundamentals, sql, python","Data Science Fundamentals, Data Science Fundamentals Specialization, Data Science Fundamentals, Data Science Fundamentals Certificate, Data Science Fundamentals with Python and SQL ..., Data Science Foundations, The Fundamentals of Data Science: A Guide for Beginners, Data Science Fundamentals Course, Basics of Data Science for Beginners| Data Science ..., Data Science & Machine Learning Fundamentals, SQL Tutorial, SQL, SQL Introduction, Unit 3: Intro to SQL: Querying and managing data, SQL Server Downloads, Learn SQL, SQL Definition, Examples, Elements, Uses, What is Structured Query Language (SQL)?, SQL Syntax, Welcome to Python.org, Python (programming language), Python Tutorial, Online Python - IDE, Editor, Compiler, Interpreter, Python, Python - Visual Studio Marketplace"
Key Technologies for Business,"key technologies, business","Key Technology: Food Processing Equipment Manufacturer, Key Tech: Product Design and Development, Key Tech Inc., Locations, Key Technology Solutions: Managed IT Services in Wixom, MI, Conveying, Key Technology, Key Technologies: Home, Key Technologies | Digital transformation, we do it tailor made, Small Business Administration, Business Definition & Meaning, Business Insider, business.com: Expert Business Advice, Tips, and Resources ..., What Is a Business? Understanding Different Types and ..., Get Listed on Google - Google Business Profile, Login and Access Meta Business Suite and Business Manager, Businessweek, How To Start A Business In 11 Steps (2024 Guide)"
Prompt Engineering,prompt engineering,"What is prompt engineering?, Prompt Engineering Guide, Prompt engineering - OpenAI API, Prompt engineering, What Is Prompt Engineering?, AI Prompt Engineering Isn't the Future, What Is Prompt Engineering? Definition and Examples, What is Prompt Engineering?"
IBM & Darden Digital Strategy,"darden digital strategy, ibm","UVA Darden Partners With IBM to Launch Online Program in ..., IBM & Darden Digital Strategy Specialization, Digital Business Strategy Course by University of Virginia, New Book From UVA Darden Professor Offers Tools to Tackle ..., IBM & Darden Digital Strategy from University of Virginia, UVA Darden Partners With IBM to Launch Online Program ..., IBM & Darden Digital Strategy - SkillBuilder, IBM & Darden Digital Strategy, Digital Business Strategy from University of Virginia, Ira Agarwal - IBM & Darden Digital Strategy, IBM - United States, IBM, International Business Machines Corporation (IBM), IBM, IBM: Jobs"
Data Engineering Foundations,data engineering foundations,"Data Engineering Foundations Specialization, Data Engineering Foundations Online Class, Badge: Data Engineering Foundations, Top 13 Data Engineering Courses (2024 Edition), Data Engineering Fundamentals Professional Certificate, Data Engineering Foundations LiveLessons Part 1, Introduction to Data Engineering Course by IBM, Online Course: Data Engineering Foundations from IBM, Professional Certificate in Data Engineering Foundations"
IBM AI Foundations for Business,"ibm ai foundations, business","Badge: Artificial Intelligence Foundations Specialization, Badge: AI Foundations - IBM Training - Global, IBM AI Foundations for Business Specialization, AI Foundations for Everyone Specialization [3 courses] (IBM), AI Foundations, a collaboration of ISTE and IBM, Foundations of AI Professional Certificate, Badge: IBM AI Foundations for Business Specialization, IBM: AI for Everyone: Master the Basics, Foundation Models - IBM watsonx.ai, Small Business Administration, Business Definition & Meaning, Business Insider, business.com: Expert Business Advice, Tips, and Resources ..., What Is a Business? Understanding Different Types and ..., Get Listed on Google - Google Business Profile, Login and Access Meta Business Suite and Business Manager, Businessweek, How To Start A Business In 11 Steps (2024 Guide)"
IBM Data Analytics with Excel and R,"ibm data analytics, r, excel","IBM Data Analyst Professional Certificate, Badge: Data Analyst Professional Certificate, Analytics Tools and Solutions, Big Data Analytics, IBM Data Analytics with Excel and R Professional Certificate, Data and Analytics, IBM - Data Analyst Professional Certificate, Data, The R Project for Statistical Computing, R (programming language), The Comprehensive R Archive Network, Roblox, R software: unfriendly but probably the best - PMC, r/Rlanguage, Free Online Spreadsheet Software: Excel | Microsoft 365, Microsoft Excel: Spreadsheets - Apps on Google Play, Microsoft Excel on the App Store, Excel Online, Microsoft Excel, Excel help & learning, Excel Definition & Meaning, Microsoft Excel: Easy Guide for Beginners With Formulas ..., Microsoft Excel: Spreadsheets ï¿½ï¿½ï¿½ Apps on ..., Excel Hand Dryer - Touchless, American Made Commerci"
